### ISSUE TITLE
SPGW-U: TCP performance issue due to GRO

### ISSUE THREAD

**Issue by dreibh** [OPENAIRINTERFACE/openair-cn-cups#16]
When running NetPerfMeter (https://www.uni-due.de/~be0001/netperfmeter/) performance tests with TCP and SCTP from an Internet server via SPGW-U and UE to a test laptop, I noticed that the TCP download speed is significantly lower than the SCTP download speed (ca. 300 kbit/s vs. >10 Mbit/s). I tracked down the problem to Generic Receive Offload (GRO) on the Ethernet interface connecting the SPGW-U to the Internet. With GRO turned on (this is the default; sudo ethtool -K ens6 gro on), the TCP performance is bad. Turning it off (sudo ethtool -K ens6 gro off) leads to the expected performance.

The issue seems that TCP packets are combined in the GRO to larger packets. In my case, the packets would have a payload of 1368 bytes. However, some received packets have payload size of 2736 bytes (i.e. 2 TCP segments have been combined into one). These segments are provided to the "pdn" interface, and the large segments get lost. The following retransmissions are made by 1368-bytes segments, so the transfer does not stall but the speed gets reduced. I assume the SPGW-U does not properly handle unexpectedly large TCP segments.

By setup:
* EPC sources: tag 2019.w47
* eNB sources: tag 2019.w44
* eNB radio board: Ettus USRP B210
* UE: Huawei E392 USB stick

**Comment by dreibh** [comment]
Here is an example packet trace recorded with tcpdump with GRO turned on. Note the payload sizes (1368 vs. 2736). The Ethernet interface itself, where the packets are received, has an MTU of 1500 bytes.
```
15:41:00.772025 IP 10.254.1.249.9000 > 10.254.1.203.41091: Flags [.], seq 13680:15048, ack 1, win 511, options [nop,nop,TS val 2575531147 ecr 2490696515], length 1368
15:41:00.772043 IP 10.254.1.249.9000 > 10.254.1.203.41091: Flags [.], seq 15048:16416, ack 1, win 511, options [nop,nop,TS val 2575531147 ecr 2490696515], length 1368
15:41:00.799762 IP 10.254.1.203.41091 > 10.254.1.249.9000: Flags [.], ack 13680, win 49658, options [nop,nop,TS val 2490696543 ecr 2575531144], length 0
15:41:00.799800 IP 10.254.1.249.9000 > 10.254.1.203.41091: Flags [.], seq 16416:17784, ack 1, win 511, options [nop,nop,TS val 2575531174 ecr 2490696543], length 1368
15:41:00.802558 IP 10.254.1.203.41091 > 10.254.1.249.9000: Flags [.], ack 15048, win 49658, options [nop,nop,TS val 2490696545 ecr 2575531147], length 0
15:41:00.802597 IP 10.254.1.249.9000 > 10.254.1.203.41091: Flags [.], seq 17784:19152, ack 1, win 511, options [nop,nop,TS val 2575531177 ecr 2490696545], length 1368
15:41:00.807101 IP 10.254.1.203.41091 > 10.254.1.249.9000: Flags [.], ack 16416, win 49658, options [nop,nop,TS val 2490696546 ecr 2575531147], length 0
15:41:00.807140 IP 10.254.1.249.9000 > 10.254.1.203.41091: Flags [.], seq 19152:21888, ack 1, win 511, options [nop,nop,TS val 2575531182 ecr 2490696546], length 2736
15:41:00.832290 IP 10.254.1.203.41091 > 10.254.1.249.9000: Flags [.], ack 17784, win 49658, options [nop,nop,TS val 2490696573 ecr 2575531174], length 0
15:41:00.832328 IP 10.254.1.249.9000 > 10.254.1.203.41091: Flags [.], seq 21888:23256, ack 1, win 511, options [nop,nop,TS val 2575531207 ecr 2490696573], length 1368
15:41:00.840156 IP 10.254.1.203.41091 > 10.254.1.249.9000: Flags [.], ack 19152, win 49658, options [nop,nop,TS val 2490696574 ecr 2575531177], length 0
15:41:00.840194 IP 10.254.1.249.9000 > 10.254.1.203.41091: Flags [.], seq 23256:24624, ack 1, win 511, options [nop,nop,TS val 2575531215 ecr 2490696574], length 1368
15:41:00.870658 IP 10.254.1.203.41091 > 10.254.1.249.9000: Flags [.], ack 19152, win 49658, options [nop,nop,TS val 2490696605 ecr 2575531177,nop,nop,sack 1 {21888:23256}], length 0
15:41:00.870697 IP 10.254.1.249.9000 > 10.254.1.203.41091: Flags [.], seq 19152:20520, ack 1, win 511, options [nop,nop,TS val 2575531245 ecr 2490696605], length 1368
15:41:00.870754 IP 10.254.1.203.41091 > 10.254.1.249.9000: Flags [.], ack 19152, win 49658, options [nop,nop,TS val 2490696613 ecr 2575531177,nop,nop,sack 1 {21888:24624}], length 0
15:41:00.870788 IP 10.254.1.249.9000 > 10.254.1.203.41091: Flags [.], seq 20520:21888, ack 1, win 511, options [nop,nop,TS val 2575531245 ecr 2490696613], length 1368
15:41:00.902315 IP 10.254.1.203.41091 > 10.254.1.249.9000: Flags [.], ack 20520, win 49316, options [nop,nop,TS val 2490696643 ecr 2575531245,nop,nop,sack 1 {21888:24624}], length 0
15:41:00.902357 IP 10.254.1.249.9000 > 10.254.1.203.41091: Flags [.], seq 24624:25992, ack 1, win 511, options [nop,nop,TS val 2575531277 ecr 2490696643], length 1368
15:41:00.904769 IP 10.254.1.203.41091 > 10.254.1.249.9000: Flags [.], ack 24624, win 49248, options [nop,nop,TS val 2490696644 ecr 2575531245], length 0
15:41:00.904810 IP 10.254.1.249.9000 > 10.254.1.203.41091: Flags [.], seq 25992:27360, ack 1, win 511, options [nop,nop,TS val 2575531279 ecr 2490696644], length 1368
15:41:00.932198 IP 10.254.1.203.41091 > 10.254.1.249.9000: Flags [.], ack 27360, win 49658, options [nop,nop,TS val 2490696676 ecr 2575531277], length 0
15:41:00.932235 IP 10.254.1.249.9000 > 10.254.1.203.41091: Flags [.], seq 27360:28728, ack 1, win 511, options [nop,nop,TS val 2575531307 ecr 2490696676], length 1368
15:41:00.932253 IP 10.254.1.249.9000 > 10.254.1.203.41091: Flags [.], seq 28728:30096, ack 1, win 511, options [nop,nop,TS val 2575531307 ecr 2490696676], length 1368
15:41:00.932437 IP 10.254.1.249.9000 > 10.254.1.203.41091: Flags [.], seq 30096:31464, ack 1, win 511, options [nop,nop,TS val 2575531307 ecr 2490696676], length 1368
15:41:01.007232 IP 10.254.1.203.41091 > 10.254.1.249.9000: Flags [.], ack 28728, win 49658, options [nop,nop,TS val 2490696749 ecr 2575531307], length 0
15:41:01.007270 IP 10.254.1.249.9000 > 10.254.1.203.41091: Flags [.], seq 31464:32832, ack 1, win 511, options [nop,nop,TS val 2575531382 ecr 2490696749], length 1368
15:41:01.042099 IP 10.254.1.203.41091 > 10.254.1.249.9000: Flags [.], ack 28728, win 49658, options [nop,nop,TS val 2490696779 ecr 2575531307,nop,nop,sack 1 {31464:32832}], length 0
15:41:01.042135 IP 10.254.1.249.9000 > 10.254.1.203.41091: Flags [.], seq 28728:30096, ack 1, win 511, options [nop,nop,TS val 2575531417 ecr 2490696779], length 1368
15:41:01.072267 IP 10.254.1.203.41091 > 10.254.1.249.9000: Flags [.], ack 30096, win 49456, options [nop,nop,TS val 2490696815 ecr 2575531417,nop,nop,sack 1 {31464:32832}], length 0
15:41:01.072306 IP 10.254.1.249.9000 > 10.254.1.203.41091: Flags [.], seq 30096:31464, ack 1, win 511, options [nop,nop,TS val 2575531447 ecr 2490696815], length 1368
15:41:01.072324 IP 10.254.1.249.9000 > 10.254.1.203.41091: Flags [.], seq 32832:34200, ack 1, win 511, options [nop,nop,TS val 2575531447 ecr 2490696815], length 1368
15:41:01.099673 IP 10.254.1.203.41091 > 10.254.1.249.9000: Flags [.], ack 32832, win 49488, options [nop,nop,TS val 2490696844 ecr 2575531447], length 0
15:41:01.099715 IP 10.254.1.249.9000 > 10.254.1.203.41091: Flags [.], seq 34200:35568, ack 1, win 511, options [nop,nop,TS val 2575531474 ecr 2490696844], length 1368
15:41:01.129504 IP 10.254.1.203.41091 > 10.254.1.249.9000: Flags [.], ack 35568, win 49658, options [nop,nop,TS val 2490696873 ecr 2575531447], length 0
15:41:01.129542 IP 10.254.1.249.9000 > 10.254.1.203.41091: Flags [.], seq 35568:36936, ack 1, win 511, options [nop,nop,TS val 2575531504 ecr 2490696873], length 1368
15:41:01.129560 IP 10.254.1.249.9000 > 10.254.1.203.41091: Flags [.], seq 36936:38304, ack 1, win 511, options [nop,nop,TS val 2575531504 ecr 2490696873], length 1368
15:41:01.129754 IP 10.254.1.249.9000 > 10.254.1.203.41091: Flags [.], seq 38304:39672, ack 1, win 511, options [nop,nop,TS val 2575531504 ecr 2490696873], length 1368
15:41:01.202059 IP 10.254.1.203.41091 > 10.254.1.249.9000: Flags [.], ack 36936, win 49658, options [nop,nop,TS val 2490696945 ecr 2575531504], length 0
15:41:01.202097 IP 10.254.1.249.9000 > 10.254.1.203.41091: Flags [.], seq 39672:41040, ack 1, win 511, options [nop,nop,TS val 2575531577 ecr 2490696945], length 1368
15:41:01.232099 IP 10.254.1.203.41091 > 10.254.1.249.9000: Flags [.], ack 36936, win 49658, options [nop,nop,TS val 2490696975 ecr 2575531504,nop,nop,sack 1 {39672:41040}], length 0
15:41:01.232135 IP 10.254.1.249.9000 > 10.254.1.203.41091: Flags [.], seq 36936:38304, ack 1, win 511, options [nop,nop,TS val 2575531607 ecr 2490696975], length 1368
15:41:01.262093 IP 10.254.1.203.41091 > 10.254.1.249.9000: Flags [.], ack 38304, win 49456, options [nop,nop,TS val 2490697005 ecr 2575531607,nop,nop,sack 1 {39672:41040}], length 0
15:41:01.262132 IP 10.254.1.249.9000 > 10.254.1.203.41091: Flags [.], seq 38304:39672, ack 1, win 511, options [nop,nop,TS val 2575531637 ecr 2490697005], length 1368
15:41:01.262151 IP 10.254.1.249.9000 > 10.254.1.203.41091: Flags [.], seq 41040:42408, ack 1, win 511, options [nop,nop,TS val 2575531637 ecr 2490697005], length 1368
15:41:01.289383 IP 10.254.1.203.41091 > 10.254.1.249.9000: Flags [.], ack 41040, win 49488, options [nop,nop,TS val 2490697035 ecr 2575531637], length 0
15:41:01.289425 IP 10.254.1.249.9000 > 10.254.1.203.41091: Flags [.], seq 42408:43776, ack 1, win 511, options [nop,nop,TS val 2575531664 ecr 2490697035], length 1368
15:41:01.319207 IP 10.254.1.203.41091 > 10.254.1.249.9000: Flags [.], ack 43776, win 49658, options [nop,nop,TS val 2490697062 ecr 2575531637], length 0
15:41:01.319247 IP 10.254.1.249.9000 > 10.254.1.203.41091: Flags [.], seq 43776:45144, ack 1, win 511, options [nop,nop,TS val 2575531694 ecr 2490697062], length 1368
15:41:01.319265 IP 10.254.1.249.9000 > 10.254.1.203.41091: Flags [.], seq 45144:46512, ack 1, win 511, options [nop,nop,TS val 2575531694 ecr 2490697062], length 1368
15:41:01.319462 IP 10.254.1.249.9000 > 10.254.1.203.41091: Flags [.], seq 46512:47880, ack 1, win 511, options [nop,nop,TS val 2575531694 ecr 2490697062], length 1368
15:41:01.412282 IP 10.254.1.249.9000 > 10.254.1.203.41091: Flags [.], seq 47880:49248, ack 1, win 511, options [nop,nop,TS val 2575531787 ecr 2490697062], length 1368
15:41:01.449932 IP 10.254.1.203.41091 > 10.254.1.249.9000: Flags [.], ack 43776, win 49658, options [nop,nop,TS val 2490697185 ecr 2575531637,nop,nop,sack 1 {47880:49248}], length 0
15:41:01.449968 IP 10.254.1.249.9000 > 10.254.1.203.41091: Flags [.], seq 43776:45144, ack 1, win 511, options [nop,nop,TS val 2575531824 ecr 2490697185], length 1368
15:41:01.482400 IP 10.254.1.203.41091 > 10.254.1.249.9000: Flags [.], ack 45144, win 49456, options [nop,nop,TS val 2490697222 ecr 2575531824,nop,nop,sack 1 {47880:49248}], length 0
15:41:01.482439 IP 10.254.1.249.9000 > 10.254.1.203.41091: Flags [.], seq 45144:46512, ack 1, win 511, options [nop,nop,TS val 2575531857 ecr 2490697222], length 1368
15:41:01.482454 IP 10.254.1.249.9000 > 10.254.1.203.41091: Flags [.], seq 46512:47880, ack 1, win 511, options [nop,nop,TS val 2575531857 ecr 2490697222], length 1368
15:41:01.512024 IP 10.254.1.203.41091 > 10.254.1.249.9000: Flags [.], ack 46512, win 49456, options [nop,nop,TS val 2490697254 ecr 2575531857,nop,nop,sack 1 {47880:49248}], length 0
15:41:01.512066 IP 10.254.1.249.9000 > 10.254.1.203.41091: Flags [.], seq 49248:50616, ack 1, win 511, options [nop,nop,TS val 2575531887 ecr 2490697254], length 1368
15:41:01.516746 IP 10.254.1.203.41091 > 10.254.1.249.9000: Flags [.], ack 49248, win 49488, options [nop,nop,TS val 2490697255 ecr 2575531857], length 0
15:41:01.516787 IP 10.254.1.249.9000 > 10.254.1.203.41091: Flags [.], seq 50616:51984, ack 1, win 511, options [nop,nop,TS val 2575531891 ecr 2490697255], length 1368
15:41:01.546862 IP 10.254.1.203.41091 > 10.254.1.249.9000: Flags [.], ack 51984, win 49658, options [nop,nop,TS val 2490697289 ecr 2575531887], length 0
15:41:01.546900 IP 10.254.1.249.9000 > 10.254.1.203.41091: Flags [.], seq 51984:53352, ack 1, win 511, options [nop,nop,TS val 2575531921 ecr 2490697289], length 1368
15:41:01.546918 IP 10.254.1.249.9000 > 10.254.1.203.41091: Flags [.], seq 53352:54720, ack 1, win 511, options [nop,nop,TS val 2575531921 ecr 2490697289], length 1368
15:41:01.547113 IP 10.254.1.249.9000 > 10.254.1.203.41091: Flags [.], seq 54720:56088, ack 1, win 511, options [nop,nop,TS val 2575531922 ecr 2490697289], length 1368
15:41:01.579223 IP 10.254.1.203.41091 > 10.254.1.249.9000: Flags [.], ack 54720, win 49658, options [nop,nop,TS val 2490697320 ecr 2575531921], length 0
15:41:01.579263 IP 10.254.1.249.9000 > 10.254.1.203.41091: Flags [.], seq 56088:58824, ack 1, win 511, options [nop,nop,TS val 2575531954 ecr 2490697320], length 2736
15:41:01.622197 IP 10.254.1.203.41091 > 10.254.1.249.9000: Flags [.], ack 56088, win 49658, options [nop,nop,TS val 2490697361 ecr 2575531922], length 0
15:41:01.622236 IP 10.254.1.249.9000 > 10.254.1.203.41091: Flags [.], seq 58824:61560, ack 1, win 511, options [nop,nop,TS val 2575531997 ecr 2490697361], length 2736
15:41:01.716278 IP 10.254.1.249.9000 > 10.254.1.203.41091: Flags [.], seq 61560:62928, ack 1, win 511, options [nop,nop,TS val 2575532091 ecr 2490697361], length 1368
15:41:01.760164 IP 10.254.1.203.41091 > 10.254.1.249.9000: Flags [.], ack 56088, win 49658, options [nop,nop,TS val 2490697489 ecr 2575531922,nop,nop,sack 1 {61560:62928}], length 0
15:41:01.760203 IP 10.254.1.249.9000 > 10.254.1.203.41091: Flags [.], seq 56088:57456, ack 1, win 511, options [nop,nop,TS val 2575532135 ecr 2490697489], length 1368
15:41:01.792015 IP 10.254.1.203.41091 > 10.254.1.249.9000: Flags [.], ack 57456, win 49456, options [nop,nop,TS val 2490697534 ecr 2575532135,nop,nop,sack 1 {61560:62928}], length 0
15:41:01.792055 IP 10.254.1.249.9000 > 10.254.1.203.41091: Flags [.], seq 57456:58824, ack 1, win 511, options [nop,nop,TS val 2575532167 ecr 2490697534], length 1368
15:41:01.792073 IP 10.254.1.249.9000 > 10.254.1.203.41091: Flags [.], seq 58824:60192, ack 1, win 511, options [nop,nop,TS val 2575532167 ecr 2490697534], length 1368
15:41:01.822118 IP 10.254.1.203.41091 > 10.254.1.249.9000: Flags [.], ack 58824, win 49456, options [nop,nop,TS val 2490697564 ecr 2575532167,nop,nop,sack 1 {61560:62928}], length 0
15:41:01.822157 IP 10.254.1.249.9000 > 10.254.1.203.41091: Flags [.], seq 60192:61560, ack 1, win 511, options [nop,nop,TS val 2575532197 ecr 2490697564], length 1368
15:41:01.827893 IP 10.254.1.203.41091 > 10.254.1.249.9000: Flags [.], ack 60192, win 49456, options [nop,nop,TS val 2490697565 ecr 2575532167,nop,nop,sack 1 {61560:62928}], length 0
15:41:01.827935 IP 10.254.1.249.9000 > 10.254.1.203.41091: Flags [.], seq 62928:64296, ack 1, win 511, options [nop,nop,TS val 2575532202 ecr 2490697565], length 1368
15:41:01.852193 IP 10.254.1.203.41091 > 10.254.1.249.9000: Flags [.], ack 62928, win 49488, options [nop,nop,TS val 2490697595 ecr 2575532197], length 0
15:41:01.852235 IP 10.254.1.249.9000 > 10.254.1.203.41091: Flags [.], seq 64296:65664, ack 1, win 511, options [nop,nop,TS val 2575532227 ecr 2490697595], length 1368
15:41:01.879587 IP 10.254.1.203.41091 > 10.254.1.249.9000: Flags [.], ack 65664, win 49658, options [nop,nop,TS val 2490697624 ecr 2575532202], length 0
15:41:01.879625 IP 10.254.1.249.9000 > 10.254.1.203.41091: Flags [.], seq 65664:67032, ack 1, win 511, options [nop,nop,TS val 2575532254 ecr 2490697624], length 1368
15:41:01.879646 IP 10.254.1.249.9000 > 10.254.1.203.41091: Flags [.], seq 67032:68400, ack 1, win 511, options [nop,nop,TS val 2575532254 ecr 2490697624], length 1368
15:41:01.879842 IP 10.254.1.249.9000 > 10.254.1.203.41091: Flags [.], seq 68400:69768, ack 1, win 511, options [nop,nop,TS val 2575532254 ecr 2490697624], length 1368
```

**Comment by dreibh** [comment]
This is some SPGW-U log output for GRO on (i.e. bad performance):
```[2020-02-28T16:27:43.893139] [spgwu] [pfcp_sw  ] [trace] pfcp_session_look_up_pack_in_core 1420 bytes, far id 55DF68B0
[2020-02-28T16:27:43.893278] [spgwu] [pfcp_sw  ] [trace] pfcp_session_look_up_pack_in_core 1420 bytes, got far, far id 55DF68F0
[2020-02-28T16:27:43.893440] [spgwu] [pfcp_sw  ] [trace] pfcp_session_look_up_pack_in_core 1420 bytes, far id 55DF68B0
[2020-02-28T16:27:43.893488] [spgwu] [pfcp_sw  ] [trace] pfcp_session_look_up_pack_in_core 1420 bytes, got far, far id 55DF68F0
[2020-02-28T16:27:43.920402] [spgwu] [pfcp_sw  ] [trace] pfcp_session_look_up_pack_in_core 1984 bytes, far id 55DF68B0
[2020-02-28T16:27:43.920538] [spgwu] [pfcp_sw  ] [trace] pfcp_session_look_up_pack_in_core 1984 bytes, got far, far id 55DF68F0
[2020-02-28T16:27:43.965987] [spgwu] [pfcp_sw  ] [trace] pfcp_session_look_up_pack_in_core 1984 bytes, far id 55DF68B0
[2020-02-28T16:27:43.966225] [spgwu] [pfcp_sw  ] [trace] pfcp_session_look_up_pack_in_core 1984 bytes, got far, far id 55DF68F0
[2020-02-28T16:27:44.051864] [spgwu] [pfcp_sw  ] [trace] pfcp_session_look_up_pack_in_core 1420 bytes, far id 55DF68B0
[2020-02-28T16:27:44.052044] [spgwu] [pfcp_sw  ] [trace] pfcp_session_look_up_pack_in_core 1420 bytes, got far, far id 55DF68F0
[2020-02-28T16:27:44.082225] [spgwu] [pfcp_sw  ] [trace] pfcp_session_look_up_pack_in_core 1420 bytes, far id 55DF68B0
[2020-02-28T16:27:44.082404] [spgwu] [pfcp_sw  ] [trace] pfcp_session_look_up_pack_in_core 1420 bytes, got far, far id 55DF68F0
[2020-02-28T16:27:44.114620] [spgwu] [pfcp_sw  ] [trace] pfcp_session_look_up_pack_in_core 1984 bytes, far id 55DF68B0
[2020-02-28T16:27:44.115198] [spgwu] [pfcp_sw  ] [trace] pfcp_session_look_up_pack_in_core 1984 bytes, got far, far id 55DF68F0
[2020-02-28T16:27:44.355548] [spgwu] [pfcp_sw  ] [trace] pfcp_session_look_up_pack_in_core 1420 bytes, far id 55DF68B0
[2020-02-28T16:27:44.355696] [spgwu] [pfcp_sw  ] [trace] pfcp_session_look_up_pack_in_core 1420 bytes, got far, far id 55DF68F0
[2020-02-28T16:27:44.391472] [spgwu] [pfcp_sw  ] [trace] pfcp_session_look_up_pack_in_core 1984 bytes, far id 55DF68B0
[2020-02-28T16:27:44.391641] [spgwu] [pfcp_sw  ] [trace] pfcp_session_look_up_pack_in_core 1984 bytes, got far, far id 55DF68F0
```
Note, that the log mentions 1984 bytes (<< 2736) and 1420 bytes.

With GRO turned off (i.e. good performance):
```
2020-02-28T16:30:49.078778] [spgwu] [pfcp_sw  ] [trace] pfcp_session_look_up_pack_in_core 1420 bytes, got far, far id 55DF68F0
[2020-02-28T16:30:49.078960] [spgwu] [pfcp_sw  ] [trace] pfcp_session_look_up_pack_in_core 1420 bytes, far id 55DF68B0
[2020-02-28T16:30:49.079054] [spgwu] [pfcp_sw  ] [trace] pfcp_session_look_up_pack_in_core 1420 bytes, got far, far id 55DF68F0
[2020-02-28T16:30:49.079304] [spgwu] [pfcp_sw  ] [trace] pfcp_session_look_up_pack_in_core 1420 bytes, far id 55DF68B0
[2020-02-28T16:30:49.079338] [spgwu] [pfcp_sw  ] [trace] pfcp_session_look_up_pack_in_core 1420 bytes, got far, far id 55DF68F0
[2020-02-28T16:30:49.079609] [spgwu] [pfcp_sw  ] [trace] pfcp_session_look_up_pack_in_core 1420 bytes, far id 55DF68B0
```
Note, that the log only mentions 1420 bytes here.

**Comment by dreibh** [comment]
Some further debugging in my setup:
* ens6: Ethernet Interface to the PDN
* pdn: dummny interface set up by spgwu

Turning off GRO (sudo ethtool -K ens6 gro off) provides the expected TCP performance. Leaving GRO turned on causes the problems.

Turning on or off the offloading features on the pdn interface (sudo ethtool -K pdn gso off tso off gro off; sudo ethtool -K pdn gso on tso on gro on) has no effect on the TCP performance.

With GRO on for ens6, a tcpdump on pdn sees large packets when the offloading features on pdn are turned on. Turning off the offloading features on pdn, the seen TCP payload size is 1408 bytes only. So, the SPGW-U should be able to handle the traffic. However, the TCP performance is *bad* in this case. That is, the only work-around for the observed problem is to turn off GRO on the Ethernet interface.

**Comment by dreibh** [comment]
I investigated the problem further. The problem seems to be the TCP checksum recomputation. Turning all features ON, except for tx-checksum-ip-generic on the pdn interface solves the issue. That is:
```
sudo ethtool -K pdn tx-checksum-ip-generic off gro on gso on tso on
sudo ethtool -K ens6 gro on gso on tso on
```

 With all features turned on, including tx-checksum-ip-generic on the pdn interface, I get the following output from T-Shark:
```
   17   0.963506   10.1.1.249 → 12.1.1.2     TCP 9000 → 46081 [ACK] Seq=17377 Ack=1 Win=511 Len=1448 TSval=3498937327 TSecr=368668689
   18   0.990076   10.1.1.249 → 12.1.1.2     TCP 9000 → 46081 [ACK] Seq=18825 Ack=1 Win=511 Len=1448 TSval=3498937354 TSecr=368668716
   19   0.993245   10.1.1.249 → 12.1.1.2     TCP 9000 → 46081 [ACK] Seq=20273 Ack=1 Win=511 Len=1448 TSval=3498937357 TSecr=368668717
   20   1.019920   10.1.1.249 → 12.1.1.2     TCP 9000 → 46081 [ACK] Seq=21721 Ack=1 Win=511 Len=1448 TSval=3498937384 TSecr=368668743
   21   1.022783   10.1.1.249 → 12.1.1.2     TCP 9000 → 46081 [ACK] Seq=23169 Ack=1 Win=511 Len=1448 TSval=3498937386 TSecr=368668746
   22   1.050893   10.1.1.249 → 12.1.1.2     TCP 9000 → 46081 [ACK] Seq=24617 Ack=1 Win=511 Len=1448 TSval=3498937414 TSecr=368668774
   23   1.053391   10.1.1.249 → 12.1.1.2     TCP 9000 → 46081 [ACK] Seq=26065 Ack=1 Win=511 [TCP CHECKSUM INCORRECT] Len=2896 TSval=3498937417 TSecr=368668776
   24   1.079981   10.1.1.249 → 12.1.1.2     TCP 9000 → 46081 [ACK] Seq=28961 Ack=1 Win=511 Len=1448 TSval=3498937444 TSecr=368668804
   25   1.121805   10.1.1.249 → 12.1.1.2     TCP [TCP Retransmission] 9000 → 46081 [ACK] Seq=26065 Ack=1 Win=511 Len=1448 TSval=3498937485 TSecr=368668834
   26   1.181550   10.1.1.249 → 12.1.1.2     TCP [TCP Retransmission] 9000 → 46081 [ACK] Seq=27513 Ack=1 Win=511 Len=1448 TSval=3498937545 TSecr=368668895
   27   1.181752   10.1.1.249 → 12.1.1.2     TCP 9000 → 46081 [ACK] Seq=30409 Ack=1 Win=511 Len=1448 TSval=3498937545 TSecr=368668895
   28   1.208766   10.1.1.249 → 12.1.1.2     TCP 9000 → 46081 [ACK] Seq=31857 Ack=1 Win=511 Len=1448 TSval=3498937572 TSecr=368668935
   29   1.213346   10.1.1.249 → 12.1.1.2     TCP 9000 → 46081 [ACK] Seq=33305 Ack=1 Win=511 Len=1448 TSval=3498937577 TSecr=368668936
   30   1.213384   10.1.1.249 → 12.1.1.2     TCP 9000 → 46081 [ACK] Seq=34753 Ack=1 Win=511 Len=1448 TSval=3498937577 TSecr=368668936
   31   1.241854   10.1.1.249 → 12.1.1.2     TCP 9000 → 46081 [ACK] Seq=36201 Ack=1 Win=511 Len=1448 TSval=3498937605 TSecr=368668962
```
Note, that T-Shark reports the TCP checksum as incorrect for the TCP segment being combined of multiple segments only. That is, the segment created by GRO seems to have a wrong TCP checksum. All other segments are okay. The following retransmissions, retransmissing not-combined segments, are also okay.

I assume that for "tx-checksum-ip-generic on", the TCP checksum does not get updated and the whole segment is dropped somewhere.

**Comment by dreibh** [comment]
Turning off all features on the pdn interface, except for tx-checksum-ip-generic, the effect becomes even more visible, since no segments are combined. It seems that all segments being somehow handled in GRO on the Ethernet interface get the wrong checksum. Then, these segments get dropped somewhere.
```
 269   7.505556   10.1.1.249 → 12.1.1.2     TCP 9000 → 46081 [ACK] Seq=259193 Ack=1 Win=511 Len=1448 TSval=3499983971 TSecr=369715343
  270   7.510118   10.1.1.249 → 12.1.1.2     TCP 9000 → 46081 [ACK] Seq=260641 Ack=1 Win=511 Len=1448 TSval=3499983976 TSecr=369715344
  271   7.537993   10.1.1.249 → 12.1.1.2     TCP 9000 → 46081 [ACK] Seq=262089 Ack=1 Win=511 Len=1448 TSval=3499984003 TSecr=369715370
  272   7.541290   10.1.1.249 → 12.1.1.2     TCP 9000 → 46081 [ACK] Seq=263537 Ack=1 Win=511 Len=1448 TSval=3499984007 TSecr=369715375
  273   7.567880   10.1.1.249 → 12.1.1.2     TCP 9000 → 46081 [ACK] Seq=264985 Ack=1 Win=511 Len=1448 TSval=3499984033 TSecr=369715403
  274   7.570542   10.1.1.249 → 12.1.1.2     TCP 9000 → 46081 [ACK] Seq=266433 Ack=1 Win=511 [TCP CHECKSUM INCORRECT] Len=1448 TSval=3499984036 TSecr=369715405
  275   7.570549   10.1.1.249 → 12.1.1.2     TCP 9000 → 46081 [ACK] Seq=267881 Ack=1 Win=511 [TCP CHECKSUM INCORRECT] Len=1448 TSval=3499984036 TSecr=369715405
  276   7.597209   10.1.1.249 → 12.1.1.2     TCP 9000 → 46081 [ACK] Seq=269329 Ack=1 Win=511 Len=1448 TSval=3499984063 TSecr=369715433
  277   7.630243   10.1.1.249 → 12.1.1.2     TCP [TCP Retransmission] 9000 → 46081 [ACK] Seq=266433 Ack=1 Win=511 Len=1448 TSval=3499984096 TSecr=369715461
  278   7.661316   10.1.1.249 → 12.1.1.2     TCP [TCP Retransmission] 9000 → 46081 [ACK] Seq=267881 Ack=1 Win=511 Len=1448 TSval=3499984126 TSecr=369715495
  279   7.661898   10.1.1.249 → 12.1.1.2     TCP 9000 → 46081 [ACK] Seq=270777 Ack=1 Win=511 Len=1448 TSval=3499984126 TSecr=369715495
  280   7.687055   10.1.1.249 → 12.1.1.2     TCP 9000 → 46081 [ACK] Seq=272225 Ack=1 Win=511 Len=1448 TSval=3499984152 TSecr=369715526
```

**Comment by dreibh** [comment]
The source for the dummy device is in drivers/net/dummy.c of the Linux kernel sources. By default, dummy_setup() enables features like NETIF_F_HW_CSUM (-> tx-checksum-ip-generic):
```
	dev->features	|= NETIF_F_ALL_TSO;
	dev->features	|= NETIF_F_HW_CSUM | NETIF_F_HIGHDMA | NETIF_F_LLTX;
	dev->features	|= NETIF_F_GSO_ENCAP_ALL;
```
There are probably applications where TCP checksum recomputations are unnecessary. In any case, the dummy device is not doing anything with this flag. So, this behaviour may be a desired feature of the dummy device. But for the SPGW-U, this is clearly not what is wanted, since the packets are forwarded and the checksum is checked later.

The SPGW-U could, after creation of the dummy device, just turn tx-checksum-ip-generic off. This can solve the issue:
```
diff --git a/src/spgwu/simpleswitch/pfcp_switch.cpp b/src/spgwu/simpleswitch/pfcp_switch.cpp
index 3c18a2e..d0ccbad 100644
--- a/src/spgwu/simpleswitch/pfcp_switch.cpp
+++ b/src/spgwu/simpleswitch/pfcp_switch.cpp
@@ -256,7 +256,7 @@ int pfcp_switch::create_pdn_socket (const char * const ifname)
 //------------------------------------------------------------------------------
 void pfcp_switch::setup_pdn_interfaces()
 {
-  std::string cmd = fmt::format("ip link set dev {0} down > /dev/null 2>&1; ip link del {0} > /dev/null 2>&1; sync; sleep 1; ip link add {0} type dummy; ip link set dev {0} up", PDN_INTERFACE_NAME);
+  std::string cmd = fmt::format("ip link set dev {0} down > /dev/null 2>&1; ip link del {0} > /dev/null 2>&1; sync; sleep 1; ip link add {0} type dummy; ethtool -K {0} tx-checksum-ip-generic off; ip link set dev {0} up", PDN_INTERFACE_NAME);
   int rc = system ((const char*)cmd.c_str());
 
   for (auto it : spgwu_cfg.pdns) {
```

**Comment by dreibh** [comment]
I created a pull request: https://github.com/OPENAIRINTERFACE/openair-cn-cups/pull/17 .
